57|Flim Flam Miracle Curative Tonic|A sickness that lies waiting there in every breath you breathe -a-Disease will up and grab you as it crawls from land and sea -a-It's amazing how infected that the natural world and all its things can be -a-Slip and fall, break or sprain something here tonight -a-But luckily for you, we've got the thing you need -a-And it's easier when all you need's the cure -a-The Flim Flam Miracle Curative Tonic -a-Is just what the doctor ordered, I'm sure -a-That's why you're so lucky we've got the thing for you -a-Just come on up, we've always got some more -a-Of the Flim Flam Miracle Curative Tonic -a-I won't need these crutches to dance out the door -a-Now some of you may suffer from feelings of despair -a-You're old, you're tired, your legs won't work, there's graying in your hair -a-Just listen and I'll tell you that you don't need to fear -a-Your ears will work, your muscles tone, your eyes will see so clear -a-Luckily for us, you've got the thing we need -a-The answer to our problems in a jar -a-The Flim Flam Miracle Curative Tonic -a-Is the greatest ever miracle by far! -a-Tonic... tonic... tonic... -a-It can make you shorter, taller, or even grow old -a-But who'd want that? -a-When with one drink -a-You can be young again– |4|20
58|The rappin' History of the Wonderbolts|Well, back in ancient times, there were the Wonderbolts of old -a-A general named Firefly, amazing and so... -a-Bold! -a-She brought them all together, spreading unity... -a-In flight! -a-Performing at their very best with wonder... -a-And with might! -a-There's Admiral Fairweather and the Colonel Purple... -a-Dart! -a-Gave Wonderbolts a bit of steel along with... -a-Lots of heart! -a-An admiral named Fairy Flight and general called... -a-Flash! -a-Helped the 'bolts fly super high... -a-With style and panache! -a-Commander Easyglider was the real cream of... -a-The crop! -a-For with her wicked moves, the Wonderbolts... -a-Soared to the top! -a-Wonderbolts, yeah! Wonderbolts... -a-Huh! -a-Wonderbolts, yeah! Wonderbolts... -a-Unh! -a-That is my rappin' history of the Wonderbolts! -a-Commander Easyglider was the real cream of the crop— -a-Well, I suggest you put down your silly cards of flash, |4|21
59|You'll Play Your Part|It isn't that I'm ungrateful -a-For all the things that I've earned, -a-For all the journeys I have taken, -a-All the lessons that I have learned -a-But I wonder where I'm going now, -a-What my role is meant to be -a-I don't know how to travel -a-To a future that I can't see -a-I have my wings, I wear this crown -a-I'm a princess, this is true -a-But it's still unclear to me -a-Just what I am meant to do -a-I wanna have a purpose -a-Wanna do all that I can -a-I wanna make a contribution -a-I want to be a part of the plan -a-Your destiny's uncertain -a-And that's sometimes hard to take -a-But it will become much clearer -a-With every new choice you make -a-Patience is never easy -a-I understand wanting more -a-I know how hard it is to wait -a-To spread out your wings and soar -a-But you stand here for a reason -a-You're gifted and you are strong -a-That crown is upon your head because -a-You belong -a-Know that your time is coming soon -a-As the sun rises, so does the moon -a-As love finds a place in every heart -a-We understand you wanting more -a-A chance to shine, a chance to soar -a-Soon will come the day it turns around -a-Know that your time is coming soon -a-As the sun rises, so does the moon |4|25
60|Let the Rainbow Remind You|Each one of us has something special -a-That makes us different, that makes us rare -a-We have a light that shines within us -a-That we were always meant to share -a-And when we come together -a-Combine the light that shines within -a-There is nothing we can't do -a-There is no battle we can't win -a-When we come together -a-There'll be a star to guide the way -a-It's inside us every day -a-See it now! See it now! -a-Let the rainbow remind you -a-That together we will always shine -a-Let the rainbow remind you -a-That forever this will be our time -a-Let the rainbow remind you |4|26
61|In Our Town|In Our Town, in Our Town -a-We don't have to wait -a-To find out that our destiny -a-Is just to emulate -a-In Our Town, in Our Town -a-We dare not compete -a-Winning only breeds the worst -a-Ego-filled conceit -a-In Our Town, in Our Town -a-We work as a team -a-You can't have a nightmare -a-If you never dream -a-Other ponies argue -a-Do you ever wonder why? -a-When you think your talent's special -a-You don't see eye-to-eye -a-There's just too many differences -a-That lead to disarray -a-But when you learn to act as one -a-It's like a holiday -a-In Our Town, in Our Town -a-We don't complicate -a-When you learn to simplify -a-Life is oh, so great -a-Join in our utopia -a-Come out of the dark -a-Banded by equality |5|1
62|Make This Castle A Home|Let's all work together -a-To make this castle shi-i-ine -a-Once we add some sparkle -a-It'll feel, it'll feel, it'll feel... -a-It'll feel divine -a-Crates of apples an' bales o' hay -a-Just makes ya feel at home -a-Furry friends and some popinjays -a-So she won't be alone -a-And we'll make, and we'll make, and we'll make -a-This castle a home -a-There's nothing like balloons and confetti -a-To greet you every time you walk through the door -a-She'll need this and those -a-Posters of all my heroes -a-How could anypony awesome ever ask for more? -a-And we'll make, and we'll make, and we'll make -a-A home she'll adore -a-Bright curtains of flowing silk and lace -a-This picture of me winning a race -a-Party cannons to give her a surprise -a-Hoes and rakes and some more garden supplies -a-Getting hugs from this nice, big, friendly bear -a-Decorate with some gemstones bright and rare -a-More of this and that -a-Don't forget the party hats -a-How could anypony awesome ask for more than that? -a-Let's all work together -a-To show that we have shown -a-Princess Twilight Sparkle -a-How we make, how we make, how we make -a-This castle a home -a-How we make, how we make -a-This castle a home -a-How we make, how we make -a-This castle a home! -a-It's not the things that ya gather 'round -a-It's not how much you own -a-The things that hold the meaning in your life -a-Are the memories you've sown -a-So we make, so we make, so we make -a-This castle a home -a-So we make, so we make -a-This castle a home -a-So we make, so we make |5|3
63|I'll Fly|When life gives you lemons -a-You can make lemonade -a-But life gave me Tank here -a-And my choice has long been made -a-No winter will come to Ponyville -a-I'll do it on my own -a-I will keep you by my side -a-So I will not be alone -a-And I'll fly, and I'll fly -a-Until the end of the sky -a-So I'll be the one who doesn't -a-Have to say goodbye -a-I'll clear the skies forever -a-So we won't be apart -a-I'll keep the weather warm for you -a-And the winter will never start -a-Weather-makers Pegasi -a-You make the seasons in the sky -a-I don't want to sabotage you -a-But you see, I've got to try -a-No winter can come here now -a-I'll keep the warmth and the sun somehow -a-I'm sorry, ponies, this has to be -a-For I need my friend and he needs me -a-I know it's wrong, but what does it matter? -a-'Cause nothing's gonna stop me now -a-I'll change it all, it's only the weather -a-And nopony's gonna bring me down -a-I'll keep the sunlight shining free -a-And I'll bust the clouds apart so you can stay with me -a-And I'll fly, and I'll fly -a-Until the end of the sky -a-So I'll be the one who doesn't -a-Have to say goodbye -a-I'll clear the skies forever -a-So we won't be apart -a-I'll keep the weather warm for you |5|5
64|Rules of Rarity|The rules of Rarity, guaranteed quality -a-This I can assure -a-For each and every dress -a-I vow to give finesse -a-With time, love, and couture -a-My favorite moment's when a pony sees it -a-That special gown that she just adores -a-That pony's now in style -a-My hard work's all worthwhile -a-Oh, yes, it makes my heart -a-My heart just soar -a-The rules of Rarity, just a parody -a-No dress here's unique -a-The panels all the same -a-Each colored windowpane -a-I fashion only makes me want to shriek! -a-Oh, to create would give me elation -a-To feel once again some inspiration -a-Come on now, Rarity -a-Give me some clarity -a-Time for your couture love to rule -a-The rules of Rarity, extra TLC -a-This feels more sublime -a-Soon now, they will see how good these can be -a-With a little extra shine -a-The rules of Rarity, guaranteed quality -a-All can see it's true -a-These new gems add such flair -a-Their beauty can't compare -a-This old style suddenly gleams anew -a-The rules of Rarity -a-Once stood for something -a-But now it feels just like some factory -a-Now every dress I make -a-With every flaw and mistake -a-Oh, how it makes my heart -a-My heart just break -a-My favorite moment's when a pony sees it -a-That special gown that she just adores -a-That pony's now in style -a-My hard work's all worthwhile -a-Oh, yes, it makes my heart |5|14
65|Sisterhood|Sisterhood -a-Is a special kind of friend -a-Sisterhood |5|17
66|We'll Make Our Mark|We've been searchin' for our cutie marks -a-For a while now -a-Tryin' to find out how we fit in -a-So many ways we've tried before -a-But we keep on tryin' more -a-'Cause the Cutie Mark Crusaders don't give in -a-We'll make our mark -a-One way or another -a-We'll make our mark -a-On the day that we discover |5|18
67|The Vote|It's time to make a change -a-This is our chance -a-Don't be afraid to do what's right -a-He's it! Vote for Pip! -a-We got an opportunity -a-To have fun again -a-A vote for Pip, and you can join the fight -a-It's time for a new leader -a-It's time to make a change -a-We're here to fight for what we believe -a-It's finally time we beat her -a-And play a better game -a-'Cause when we vote together -a-There's nothing that we can't achieve -a-I don't believe what I am hearing -a-I'm the only one you should be cheering -a-Pipsqueak? Try "Pip's weak!" Don't you think? -a-But a diamond is perfection -a-It's natural selection -a-So your vote better be for me, not the weakest link -a-Everypony has their little secrets -a-A vote for me will help you keep them safe -a-Like your creepy super strength! -a-Or your mane extension -a-A little thing I won't mention -a-Or those freakish large teeth in your face! -a-You've gotta vote for change -a-It's time for a new leader -a-End all the tyranny -a-Vote now and we can beat her -a-It's now another day -a-And we believe in what's right -a-Vote for Pip! Vote for Pip! -a-Our victory is in sight -a-I've a tiny suggestion -a-That you should be aware -a-You could probably win this election -a-If you show them all you real— -a-Vote! -a-Stand strong and don't be afraid, ponies -a-Let's free ourselves from the past -a-For Pip! -a-Vote! -a-He's it! Vote for Pip! Vote! -a-We'll let honor win out against the tyranny -a-And make a change that will last -a-For Pip! -a-Vote! -a-Vote for Pip! -a-It's time for a new leader -a-It's time to make a change -a-We're here to fight for what we believe -a-Vote for Pip! -a-It's finally time we beat her -a-And play a better game -a-'Cause when we vote together -a-There's nothing that we can't achieve |5|18
68|The Pony I Want to Be|If I'm a diamond -a-Then why do I feel so rough? -a-I'm as strong as a stone -a-Even that's not enough -a-There's something jagged in me -a-And I've made such mistakes -a-I thought that diamonds were hard -a-Though I feel I could break -a-Would you believe -a-That I've always wished I could be somepony else? -a-Yet I can't see -a-What I need to do to be the pony I want to be -a-I've been told my whole life -a-What to do, what to say -a-Nopony showed me that -a-There might be some better way -a-And now I feel like I'm lost -a-I don't know what to do -a-The ground is sinking away -a-I'm about to fall through -a-Would you believe -a-That I've always wished I could be somepony else? -a-Yet I can't see -a-What I need to do to be the pony I want to be |5|18
69|Light of Your Cutie Mark|Cutie Mark Crusaders, get out of my way -a-Those ponies need to know the truth -a-And they'll hear it from me -a-Stop! Diamond Tiara, this is not the way -a-You know you're better than this hostility -a-You don't even know me at all -a-Don't understand the meaning of my fall -a-What my family would think if I ever -a-Fail at anything -a-I'm a diamond – that means you'll never break -a-No matter what be the cost of the path I take -a-Whatever I have to do to win in the end -a-Stop! This is not the answer -a-Wait! And it's plainly seen -a-Listen! You can redeem yourself -a-But by helping others, not by being mean -a-We know you want friends who admire you -a-You want to be the star with all the power too -a-But there's a better way, there's a better wa -a-ay -a-There's so much more still left to -a-Learn about yourself -a-See the light that shines in you -a-We know you can be somepony else -a-You can stop right now -a-And try another start -a-You'll finally free yourself from the dark -a-And see the light |5|18
70|The Pony I Want to Be|We'll build a playground -a-For all of us to enjoy -a-So full of games -a-There's enough for each girl and boy -a-I want to help and do -a-Everything that I can -a-I'm here to show you I changed -a-Listen up, here's the plan -a-Bring it in! That's right, keep it coming! Hey there, you with the amazing strength. Can you help them move that merry-go-round across the lawn? Thank you so much! And you with the super teeth, we need you to help with that teeter-totter. You got it! That's the spirit! -a-There's so much I can do -a-To help everypony else -a-I see the light that shines in me -a-I know I can be my better self -a-I can free the past -a-'Cause now the future's bright for me -a-My cutie mark has set me free -a-To do what's right and be the pony I want to be |5|18
71|We'll Make Our Mark|We were searching for our cutie marks -a-For a while there -a-Trying to find out how we fit in -a-So many ways we've tried before -a-But we kept on trying more -a-'Cause the Cutie Mark Crusaders don't give in -a-Now we know what it took all along -a-And our journey here is never really done -a-For it is more than just a mark -a-It's a place for us to start -a-An adventure that has only just begun -a-We'll make our mark -a-Show the world what we can do -a-We'll make our mark -a-Helping fillies to break through -a-To the ultimate reward of a cutie mark -a-I'm so proud of you, little buddy -a-You've taught me a thing or two -a-You've inspired everypony around you -a-And you've inspired me too -a-You've made your mark -a-Done Equestria so proud -a-You've made your mark -a-And we're here to sing it loud -a-For the ultimate reward of your cutie mark -a-We started out just three -a-Crusaders driven to see -a-What we find in our hearts -a-Discover our destiny -a-And here we are, best friends -a-About to start it again -a-An adventure that never will end -a-We'll make our mark -a-Helping fillies most in need -a-We'll make our mark -a-So each one of them succeeds |5|18
72|Equestria, the Land I Love|Equestria, the land I love -a-A land of harmony -a-Our flag does wave from high above -a-For ponykind to see -a-Equestria, a land of friends -a-Where ponykind do roam -a-They say true friendship never ends |5|24
73|The Spectacle|Time for the spectacle -a-Time for the show -a-The lights are bright and the colors glow -a-I'm not just anypony -a-I think you know -a-The time is now, it's about to blow! -a-Razzle dazzle -a-Glitz and glam -a-Turn it all up, it's a spectacle -a-Razzle dazzle -a-Glitz and glam -a-Turn it all up, it's a spectacle -a-Give me more -a-Razzle dazzle -a-Glitter eyes, big surprise -a-Lights, cameras -a-Razzle dazzle -a-Glitz and glam -a-Turn it all up, it's a spectacle -a-Hear the applause -a-Here to impress |5|24
74|The Magic Inside|I'm here to show you who I am -a-Throw off the veil, it's finally time -a-There's more to me than glitz and glam, oh-whoa -a-And now I feel my stars align -a-For I had believed what I was sold -a-I did all the things that I was told -a-But all that has changed, and now I'm bold -a-'Cause I know -a-That I am just a pony -a-I make mistakes from time to time -a-But now I know the real me -a-And put my heart out on the line -a-And let the magic in my heart stay true -a-Whoa-whoa-whoa-whoa -a-And let the magic in my heart stay true -a-Whoa-whoa-whoa-whoa -a-Just like the magic inside of you -a-And now I see those colors -a-Right before my eyes -a-I hear my voice so clearly -a-And I know that it is right -a-They thought I was weak, but I am strong -a-They sold me the world, but they were wrong -a-And now that I'm back, I still belong -a-'Cause I know -a-That I am just a pony -a-I make mistakes from time to time -a-But now I know the real me -a-And put my heart out on the line -a-And let the magic in my heart stay true -a-Whoa-whoa-whoa-whoa -a-And let the magic in my heart stay true -a-Whoa-whoa-whoa-whoa -a-Just like the magic inside of you |5|24
75|Equestria, the Land I Love|Equestria, the land I love -a-A land of harmony -a-Our flag does wave from high above -a-For ponykind to see -a-Equestria, a land of friends -a-Where ponykind do roam -a-They say true friendship never ends |5|24
76|Friends Are Always There For You|I never thought that I would find a place -a-To step right in and start again -a-I never thought that I could just begin -a-Right where I left off and make a friend -a-Don't ever think that it might be too late -a-You don't have to wait, there's no mistakes with the friends you make -a-A friendship's only made of what you bring -a-And if you do it right, you can do anything -a-Just use your eyes -a-This time, no lies -a-Just don't disguise -a-Who you are inside -a-Because your friends are always there for you -a-You don't have to be the same for friendship to be true -a-Because your friends are always there for you -a-Around the world, it's still the same -a-Together you have more to gain -a-There's nothing that a friend won't do -a-Everywhere you go -a-Friendship there will grow -a-When you find it, it's the key -a-Friends can change the world, you see -a-Everywhere you go -a-Friendship there will grow -a-When you find it, it's the key -a-Friends can change the world  -a-Friends can change the world  |5|26
77|Out On My Own|I never imagined myself out on my own -a-Tryin' to find out what's next for me -a-The Cutie Mark Crusaders have always been my home -a-Maybe now there's more that I could be -a-I guess as time goes by -a-Everypony has to go out on their own -a-And maybe someday I'll have to try -a-Somethin' new that's just for me -a-A little somethin' that could be -a-Just my own and I won't feel so left behind -a-We used to say that we'd be always side by side -a-Maybe things are changin' and this could mean goodbye -a-I always thought our friendship was all I'd ever need -a-We've always been crusadin' – what else is there for me? -a-I guess as time goes by -a-Everypony has to go out on their own -a-And maybe someday I'll have to try -a-Somethin' new that's just for me -a-A little somethin' that could be |6|4
78|Hearth's Warming Eve Is Here Once Again|Ponies' voices fill the night -a-Hearth's Warming Eve is here once again -a-Happy hearts so full and bright -a-Hearth's Warming Eve is here once again -a-Oh, what a sight -a-Look at the light -a-All for tonight -a-Hearth's Warming Eve is here once again -a- they're just so -a-Hearth's Warming Eve is here once again -a-Gonna make some awesome snow -a-Hearth's Warming Eve is here once again -a-The chill wind blows -a-Making a show -a-Snowflakes aglow -a-Hearth's Warming Eve is here once again -a-A day that's filled with songs to sing -a-Ding-dong, ding-dong-ding -a-Cakes and pastries we shall bring -a-Ding-dong, ding-dong-ding -a-We're so busy making merry -a-Windigos should all be wary -a-As our mighty voices carry -a-Hearth's Warming Eve is here once again -a-Decorations we shall make -a-Hearth's Warming Eve is here once again -a-Perfection you just cannot fake -a-Hearth's Warming Eve is here once again -a-Not one mistake -a-Don't let that break -a-Oh, goodness' sake! -a-Hearth's Warming Eve is here once a— -a-Happy, happy Hearth's Warming Eve -a-Happy, happy Hearth's Warming Eve -a-Hearth's Warming Eve is here once again! -a-Hearth's Warming Eve is filled with presents -a-Some take you by surprise -a-A story shared by your good friends -a-That makes your spirits rise -a-Sometimes you just let go of the past -a-Enjoy the present while it lasts -a-And really it's not that much to ask -a-With good friends by your side -a-Now it's time to celebrate -a-Hearth's Warming Eve is here once again -a-All together, feeling great -a-Hearth's Warming Eve is here once again -a-Can hardly wait -a-We'll party 'til late -a-Our favorite date -a-Hearth's Warming Eve is here once a— -a-Happy, happy Hearth's Warming Eve -a-Happy, happy Hearth's Warming Eve |6|8
79|Can I Do It On My Own|Everypony has times in their lives -a-When their hearts are filled with doubt -a-Frustration builds up inside -a-And it makes you want to shout -a-But if you just take that first step -a-The next one will appear -a-And you find you can walk, then run -a-Then fly...! -a-Into the stratosphere -a-You've got to give it your best -a-So you can pass the test -a-Give it everything that you've got -a-And we know you can win -a-You just have to begin -a-Have to give it your very best shot -a-There are times when you want to give up -a-When you think that you can't go on -a-But if you fight through with all of your might -a-You will find that you can't go wrong -a-That you could do it all along -a-Everypony has times in their lives -a-When their hearts are filled with doubt -a-But if you just give it your all -a-You'll start to work it out -a-And I know I can't give up too soon -a-Get myself in the zone -a-And I find I can walk, then run -a-Then fly...! -a-I can do it on my own -a-You can do it on your own -a-I can do it on my own |6|11
80|It's Gonna Work|Here's what I know: -a-If you want to succeed -a-You must follow the trends, that's the key -a-If you want to show -a-That you've got what it takes -a-You must be what they want you to be -a-Here's what I know: -a-Your food is so good -a-The flavor's so fancy and free -a-You just need to show -a-That unique sense of taste -a-Go on, be yourself, let them see -a-It's gonna work -a-I know it's gonna work -a-It's gonna work out just fine, trust me -a-It's gonna work -a-I swear it's gonna work -a-It's gonna work out just fine, you'll see! -a-You need to change -a-If you want to compete -a-But fear not, for I know what to do -a-I know it feels strange -a-But trust me, when we're done -a-We'll make sure that you're a hit, too -a-Don't ever change -a-Being different is good -a-Don't let what others do be your cue -a-Never rearrange -a-'Cause somepony said you should -a-Just trust your heart, it will know what to do -a-It's gonna work -a-I know it's gonna work -a-It's gonna work out just fine, trust me -a-It's gonna work -a-I swear it's gonna work -a-It's gonna work out just fine, you'll see! -a-Be unique -a-Just be the same -a-Trust your heart -a-You'll make your name -a-We'll help you every step of the way -a-Because we know what you need to do -a-And you should know it too -a-It's gonna work -a-I know it's gonna work -a-It's gonna work out just fine, trust me -a-It's gonna work -a-I swear it's gonna work |6|12
81|Derby Racers|Go, go, go! -a-Check me out, racin' the Derby -a-Check out my old-fashioned cart -a-Check me out, racing the Derby -a-In my original work of art -a-Check me out, faster than ever -a-There's nopony can catch me now -a-Let me out, I'd do it over -a-If I only knew how! -a-Giddyup, derby racers -a-Giddyup, derby racers -a-Giddyup, derby racers -a-Go, go, go! -a-My cart's the most original -a-Designed with imagination -a-My cart's the most traditional -a-Just plain, no complications -a-Look at me, I am the ace -a-Might as well give up the chase -a-Wish we could stop this race -a-Start again and do it our way -a-Giddyup, derby racers -a-Giddyup, derby racers -a-Giddyup, derby racers -a-Go, go, go! -a-Gotta get some attention -a-If I want that ribbon -a-Gotta push the limit further -a-Blow away the competition -a-Gotta coast on through -a-Just relax, we're gonna cruise it -a-Guess I don't really care -a-Since we're clearly gonna lose it -a-See, everypony's watching -a-Presentation is a glory -a-Just passed you, even faster -a-Speed is king, end of story -a-Bigger, bolder down the track -a-Love the view from the back of the pack -a-Won't stop, we're on the attack -a-Too late to take it all back! -a-Giddyup, derby racers -a-Giddyup, derby racers -a-Giddyup, derby racers |6|14
82|A Changeling Can Change|Would you say I'm a hero -a-Glorious and brave -a-If I told you something you wouldn't believe? -a-That sometimes I'm scared -a-And I can make mistakes -a-And I'm not so heroic, it seems -a-But if day can turn to night -a-And the darkness turn to light -a-Then why can't we imagine a changeling can change? -a-No two ponies are exactly the same -a-No two snowflakes ever match their design -a-And I thought I was strong -a-But I was nothing but wrong -a-When I forgot to be friendly and kind -a-But if day can turn to night -a-And the darkness turn to light -a-Then why can't we imagine a changeling can change? -a-Would you say I'm a hero -a-Glorious and brave -a-If I told you something you wouldn't believe? -a-This changeling, it seems -a-Knows the real me -a-And would stay by my side 'til the end -a-So if day can turn to night -a-And the darkness turn to light -a-Then why can't we imagine -a-Just why can't we imagine |6|16
