100|The Last Laugh|So you're saying it's a mix-up -a-Of the sounds that I just made -a-That coaxed the snicker from your throat -a-In a delicate cascade? -a-If I did it one more time -a-If I reproduced that feat -a-Mixed up some letters here and there -a-You'd "lelly-baugh" tout suite? -a-Then that's all I need to do -a-That's who I need to be -a-I thought I needed laughter -a-But it has to come from me -a-Squirting flowers and knobby knees -a-Rubber chickens my expertise -a-If you want laughter, then stick with Cheese -a-I suppose now I should amp things up -a-To get the thing I'm after -a-Move whole syll-AB-les around -a-And change em-PHA-sis to get laughter  -a-Can't stop now, I'm on a roll -a-I've almost got it back -a-Bright folks like you aren't subject to -a-My play-on-words attack! -a-With something else, I'll have to play -a-To get me where I'm going -a-To get the laughter flowing -a-And it's what I need to do -a-It's who I need to be -a-I thought I needed laughter -a-But it has to come from me -a-Follow right behind, if you please -a-Walk this way and I guarantee -a-If you want laughter, then stick with Cheese -a-Accordion solo! -a-And now my biggest test -a-The hardest fish to fry -a-Ooh-ooh-ooh-ooh -a-A mind so analytical -a-A sense of humor dry  -a-So dry! -a-To make you laugh would prove to me -a-That this experiment's done -a-Ooh-ooh-ooh-ooh -a-Something ridiculous and not too smart -a-Something like a pun -a-Hey, Sans! How did the laughing bird's eggs hatch? They cracked up! -a-Then that's all I need to do -a-That's all I need to see -a-I thought I needed laughter -a-But it had to come from me -a-Squirting flowers and knobby knees -a-Rubber chickens and Dungarees |9|14
101|Being Big is All It Takes|Woke up this morning feeling tired and small -a-But look at us now - we must be ninety feet tall -a-Don't have to worry 'bout making mistakes -a-Because being big is all it takes -a-A tiny twist of fate brought on this big change -a-Give me room, gotta zoom, I've got plans to arrange -a-Can do what I want, be it run, trot, or traipse -a-'Cause being big is all it takes -a-Being big isn't just a size -a-At bedtime we don't even have to close our eyes -a-We're in control now, for goodness' sake -a-'Cause being big is all it takes -a-Leaving behind the little pony you've known -a-Stepping out, growing up, making moves of my own -a-You can't tell me no, there's no place I can't go -a-Mountains, cities, jungles, or lakes -a-'Cause being big is all it takes -a-Being big isn't just a size -a-We'll tell you our opinion 'cause we're oh, so wise -a-We're in control now, for goodness' sake -a-'Cause being big is all it takes -a-I can eat all the snacks 'cause that's for me to decide -a-We know how it all works, even what we ain't tried -a-Facts don't matter now 'cause it's not what we know -a-We can win any argument with... -a-"Because I say so!" -a-Can't stop us now, don't try to stand in our way -a-We're awake, gonna take all we can from today -a-Once we had to listen, now you'll hear what we say -a-Everything is always okay -a-'Cause being big is all it taaaaaakes |9|22
102|The Magic of Friendship Grows|When I started out, I was unsure -a-I thought I knew all that I needed, didn't know what to expect -a-But when my walls came down, I saw the truth -a-All along something was missing -a-And I think you'll see it, too -a-This is where the magic happens -a-This is where the magic lives -a-Our friendships weave together stronger -a-The bonds grow deeper, lasting longer -a-And the greatest spell you'll know -a-Is how the Magic of Friendship grows -a-And no matter how much time goes by -a-The party will still be here with some fun new games to try -a-Big adventure's waiting obviously -a-Long as we're still here together -a-We'll be flying happily -a-This is where the magic happens  -a-This is where the magic lives  -a-Our friendships weave together stronger -a-The bonds grow deeper, lasting longer -a-And the greatest spell there is -a-What the Magic of Friendship gives -a-And it's somethin' true to pass on down -a-To generations yet to come -a-And we'll never stop believing in -a-The generosity of the friendships we've won -a-And because the love that I feel -a-For every single living creature is something that is real -a-Friendship happens so naturally -a-Oh, and how I used to wonder -a-What friendship could be! -a-This is where the magic happens  -a-This is where the magic lives  -a-Our friendships weave together stronger -a-The bonds grow deeper, lasting longer -a-And the greatest spell you'll know  -a-Is how the Magic of Friendship grows |9|26
103|This strange new world|I've never seen a place -a-That's quite like this -a-Everything is turned around -a-This crazy world is upside-down -a-Getting on my feet -a-It's the hand that I was dealt -a-But I don't have much time with them -a-Got to learn all that I can -a-They don't use any magic or fly with any wings -a-I don't get these funny clothes, skinny legs or tiny nose -a-Everything's confusing when it seems so new -a-But I look a little closer and it starts to feel familiar too -a-What a strange new world (what a strange new world) -a-I'm trying to make heads or tails of this strange new world (what a strange new world) -a-Sorting through the small details of this strange new world |10|1
104|Helping Twilight win the wrown|Hey, hey, everybody -a-We've got something to say -a-We may seem as different -a-As the night is from day -a-But you look a little deeper -a-And you will see -a-That I'm just like you -a-And you're just like me -a-Yeah! -a-Hey, hey, everybody -a-We're here to shout -a-That the magic of friendship -a-Is what it's all about -a-Yeah, we thought we were different -a-As the night is from the day -a-Until Twilight Sparkle -a-Helped us see another way -a-So get up, get down -a-If you're gonna come around -a-We can work together -a-Helping Twilight win the crown -a-So get up, get down -a-'Cause it's gonna make a sound -a-If we work together -a-Helping Twilight Sparkle win the crown -a-Hey, hey, hands up now -a-We're sending a message to the crowd -a-Hands wave up, then come down -a-We party together all around -a-Generous, honesty -a-Laughter, kindness, loyalty -a-Twilight helped us each to see -a-All that we can be! -a-So get up, get down -a-If you're gonna come around -a-We can work together -a-Helping Twilight win the crown -a-So get up, get down -a-'Cause it's gonna make a sound -a-If we work together -a-Helping Twilight Sparkle win the crown -a-I'm gonna be myself -a-No matter what I do -a-And if we're different, yeah -a-I want you to be true to you -a-If you follow me -a-We'll put our differences aside -a-We'll stick together and -a-Start working on that school pride! -a-Jump up, make a sound (Hey!) -a-Stomp your hooves, turn around -a-Start now, make a change -a-Gonna come around -a-Jump up, make a sound (Hey!) -a-Stomp your hooves, turn around -a-Canterlot Wondercolts -a-Help her win the crown -a-Jump up, make a sound (Hey!) -a-Stomp your hooves, turn around -a-Start now, make a change -a-Gonna come around -a-Jump up, make a sound (Hey!) -a-Stomp your hooves, turn around -a-Canterlot Wondercolts -a-Help her win the crown -a-Jump up, make a sound (Hey!) -a-Stomp your hooves, turn around -a-Start now, make a change -a-Gonna come around -a-Jump up, make a sound (Hey!) -a-Stomp your hooves, turn around |10|2
105|Time to come together|It's time for us to come together -a-It's the only way that things will get better -a-It's time for us to take a stand -a-So come on and lend a helping hand -a-Fix it up -a-Yeah, it's all right -a-We'll get it ready by tonight -a-Mix it up -a-Yeah, help a friend -a-We'll come together in the end -a-It's time to show that we've got school spirit -a-Raise your voice and let everyone hear it -a-It's time to show that we're strong -a-So come on, everybody, sing along -a-(Look...) Look how we've all come together -a-(Things...) Things are only just starting to get better -a-(Look...) Look how we've all come together -a-(Things...) Things are only gonna get better, better, better, better! -a-(We... will...) Fix it up, yeah, it's all right -a-(Come... tonight, tonight...) We'll get it ready by tonight -a-(We... will...) Mix it up, yeah, help a friend -a-(Come... together, together...) We'll come together in the end -a-(We... will...) Fix it up, yeah, it's all right -a-(Come... tonight, tonight...) We'll get it ready by tonight -a-(We... will...) Mix it up, yeah, help a friend |10|3
106|This is our big night|This is our big night -a-We're getting ready -a-And we're doing it up right -a-This is our big night -a-Friendship survived, -a-Now we'll start it out right -a-The time's right, gonna make it last 'cause it's the first night -a-That we're ever gonna start to just have fun together -a-We're so glad, so happy we could never be mad -a-Did it right now, this is our big night now -a-Six friends on the way up now -a-Six friends here to show you how -a-This is our big night -a-We're getting ready -a-And we're doing it up right -a-This is our big night -a-We made it happen -a-Now let's party all night -a-This is our big night -a-This is our big night -a-This is our big night -a-This is our big night -a-We made it happen -a-Now let's party all night -a-We're here now and we worked so hard to make it come around -a-To tonight so let's try to make it last forever -a-The school lights so bright, beat is pumping through the night -a-Party's starting, DJ's got the music just right! -a-Six friends on the way up now -a-Six friends here to show you how -a-This is our big night -a-This is our big night |10|4
107|A friend for Life|A friend for life -a-That's what you are to me -a-A friend for life -a-That's what you are to me -a-I couldn't see what was -a-Right there in front of me -a-Turned my back -a-Got my mind off track -a-Yeah -a-You saw a world that was -a-Something new entirely -a-Helped me to see -a-All the possibilities -a-Oooohhhhh.... -a-Like a star in the day light -a-Or like a diamond at night -a-Your light was hidden -a-From my sight -a-A friend for life -a-That's what you are to me -a-A friend for life -a-That's what you are to me -a-Every friendship is tested -a-You say you're sincere -a-But it's all unclear now -a-But with a word -a-Everything changes -a-And just like that -a-You and I are right back -a-Oohhh.... -a-Like a star in the day light -a-Or like a diamond at night -a-Your light will shine -a-When the time is right -a-A friend for life -a-That's what you are to me -a-A friend for life -a-That's what you are to me -a-When I put my hand out -a-And I thought I would fall -a-You knew what I needed -a-And you came around -a-To fix it all -a-A friend for life -a-That's what you are to me -a-A friend for life -a-That's what you are to me -a-A friend for life -a-That's what you are to me -a-Ooohh-wa-ooohh -a-Like a star in the day light -a-A friend for life -a-That's what you are to me -a-Like a diamond at night -a-Ah-ah-oh, ah-ah-ohhh |10|5
108|Equestria Girls Rainbow Rocks Opening|We used to fight with each other -a-(Oh, whoa-oh, whoa-oh, whoa-oh) -a-That was before we discovered -a-(Oh, whoa-oh, whoa-oh, whoa-oh) -a-That when your friendship is real -a-(Oh, whoa-oh, whoa-oh, whoa-oh) -a-Yeah, you just say what ya feel -a-And the music, yeah, the music -a-Gets us to the top -a-As we learn how the rainbow... -a-Rainbow Rocks! -a-You can pick up the bass -a-(Oh, whoa-oh, whoa-oh, whoa-oh) -a-And you can play the guitar -a-(Oh, whoa-oh, whoa-oh, whoa-oh) -a-You can bang on the drums -a-(Oh, whoa-oh, whoa-oh, whoa-oh) -a-Or you can sing like a star -a-And the music, yeah, the music -a-Gets us to the top -a-As we learn how the rainbow... -a-Rainbow Rocks! -a-As we learn how the rainbow... |11|1
109|Better Than Ever|There was a time we were apart -a-But that's behind us now -a-See how we've made a brand new start -a-And the future's lookin' up, ah-oh, ah-oh -a-And when you walk these halls -a-You feel it everywhere -a-Yeah, we're the Wondercolts forever, ah-oh, yeah! -a-We are all together -a-(Ah, ah, oh-oh-oh-oh) -a-Now it's better than ever -a-(Ah, ah, oh-oh-oh-oh) -a-You can feel it, we are back (You... can... feel... it...) -a-And I'm so glad that we're better -a-Better than ever -a-Whoa-oh, oh-whoa-oh -a-Oh yeah, we're better than ever -a-Whoa-oh, oh-whoa-oh -a-There was a time we couldn't see -a-Past the differences -a-That separated you and me -a-And it left us on our own -a-But now you walk these halls -a-And friends are everywhere -a-Yeah, we're the Wondercolts forever, ah-oh, yeah! -a-We are all together -a-(Ah, ah, oh-oh-oh-oh) -a-Now it's better than ever -a-(Ah, ah, oh-oh-oh-oh) -a-Now that we are back on track (Now... that... we... are...) -a-Yes, I'm so glad that we're better -a-Better than ever -a-Whoa-oh, oh-whoa-oh -a-Oh yeah, we're better than ever -a-Whoa-oh, oh-whoa-oh -a-Oh yeah, we're better than ever -a-Whoa-oh, oh-whoa-oh |11|2
110|Battle|We heard you want to get together  -a-We heard you want to rock this school  -a-We've thought of something that is better  -a-Something that changes all the rules  -a-Why pretend we're all the same  -a-When some of us shine brighter?  -a-Shine brighter  -a-Here's a chance to find your flame  -a-Are you a loser or a fighter?  -a-Me and you, you and me  -a-Why don't we see who is better?  -a-We don't have to be one and the same thing  -a-Oh, what's so wrong with a little competition?  -a-Are you afraid of failing the audition?  -a-You're a star and you should know it  -a-Yeah, you rise above the rest  -a-It doesn't matter who you hurt  -a-If you're just proving you're the best  -a-Battle! You wanna win it  -a-Let's have a battle, battle of the bands  -a-Let's have a battle, we'll go all in it  -a-Let's have a battle, battle, battle  -a-Battle of the bands  -a-Battle!  -a-I can beat you!  -a-Battle!  -a-Ha! You wish!  -a-Battle!  -a-I so want this!  -a-Battle!  -a-Not if I get it first!  -a-Me and you, you and me  -a-Why don't we see who is better?  -a-We don't have to be one and the same thing  -a-Oh, what's so wrong with a little competition?  -a-I'm going out and winning the audition  -a-Battle! We wanna win it  -a-Let's have a battle, battle of the bands  -a-Let's have a battle, we'll go all in it  -a-Let's have a battle, battle, battle  |11|3
111|Bad Counter Spell|Hey, hey, listen -a-We've got a message for you -a-We're not all alike -a-But our friendship is true -a-Yeah, we're really different -a-But we still get along -a-So hey, hey, listen to our song -a-You may think you're in control -a-But we're here to prove you wrong -a-With our friendship and our music -a-With the power of our song -a-Gonna stomp our feet, clap our hands -a-With the magic of friendship |11|4
112|Shake tour tail|We've just got the day to get ready -a-And there's only so much time to lose -a-Because tonight, yeah, we're here to party -a-So let's think of something fun to do -a-We don't know (we don't know) what's gonna happen -a-We just know (we just know) it's gonna feel right -a-All our friends are here -a-And it's time to ignite the lights! -a-Shake your tail 'cause we're here to have a party tonight -a-Shake your tail, shake your tail -a-Shake your tail 'cause we're here to have a party tonight -a-Shake your tail, shake your tail -a-So what you didn't get it right the first time -a-Laugh it off, no one said it is a crime -a-Do your thing, you know you're an original -a-Your ideas are so funny that they're criminal -a-Ohhh-ahh! -a-We've just got the day to get ready -a-And there's only so much time to lose -a-Because tonight, yeah, we're here to party -a-So let's think of something fun to do -a-We don't know (we don't know) what's gonna happen -a-We just know (we just know) it's gonna feel right -a-All our friends are here -a-And it's time to ignite the lights! -a-Shake your tail 'cause we're here to have a party tonight -a-Shake your tail, shake your tail -a-Shake your tail 'cause we're here to have a party tonight -a-Shake your tail, shake your tail -a-Shake your tail 'cause we're here to have a party tonight -a-Shake your tail, shake your tail -a-Shake your tail 'cause we're here to have a party tonight -a-Shake your tail, shake your tail |11|5
113|Under our spell|Oh-whoa-oh, oh-whoa-oh -a-You didn't know that you fell -a-Oh-whoa-oh, oh-whoa-oh -a-Now that you're under our spell -a-Blindsided by the beat -a-Clapping your hands, stomping your feet -a-You didn't know that you fell -a-Oh-whoa-oh-oh-oh -a-Now you've fallen under our spell -a-Oh-whoa-oh-oh-oh-oh -a-We've got the music, makes you move it -a-Got the song that makes you lose it -a-We say "jump", you say "how high?" -a-Put your hands up to the sky -a-We've got the music, makes you move it -a-Got the song that makes you lose it -a-We say "jump", you say "how high?" -a-Put your hands up to the sky -a-Oh-whoa-oh, oh-whoa-oh -a-You didn't know that you fell -a-Oh-whoa-oh, oh-whoa-oh -a-Now that you're under our spell -a-Listen to the sound of my voice -a-Oh-oh, whoa-oh-oh -a-Soon you'll find you don't have a choice -a-Oh-oh, whoa-oh-oh -a-Captured in the web of my song -a-Oh-oh, whoa-oh-oh -a-Soon you'll all be singing along -a-Oh, whoa, oh -a-We've got the music, makes you move it -a-Got the song that makes you lose it -a-We say "jump", you say "how high?" -a-Put your hands up to the sky -a-We've got the music, makes you move it -a-Got the song that makes you lose it -a-We say "jump", you say "how high?" -a-Put your hands up to the sky -a-Oh-whoa-oh, oh-whoa-oh -a-You didn't know that you fell -a-Oh-whoa-oh, oh-whoa-oh -a-Now that you're under our spell -a-Oh-whoa-oh, oh-whoa-oh -a-You didn't know that you fell -a-Oh-whoa-oh, oh-whoa-oh |11|6
114|Tricks Up My Sleeve|Ya better believe -a-I got tricks up my sleeve -a-And I captivate -a-'Cause I'm powerful and grea-ea-eat -a-Oh, whoa, oh-oh-oh-oh -a-Ya better believe -a-I got tricks up my sleeve -a-See me dominate -a-'Cause I'm powerful and grea-ea-eat -a-Oh, whoa, oh-oh-oh-oh -a-You think you've got what it takes to go toe to toe? -a-I've got more moves than you'll ever know -a-I own the stage, I'm all the rage -a-You're from the past, I'm from the Space Age -a-Come on, you're just making noise -a-Listen how my music destroys -a-Anything you throw at me -a-I'm gonna throw back, just wait and see-ee -a-Ya better believe -a-I got tricks up my sleeve -a-And I captivate -a-'Cause I'm powerful and grea-ea-eat -a-Oh, whoa, oh-oh-oh-oh -a-Ya better believe -a-I got tricks up my sleeve -a-See me dominate -a-'Cause I'm powerful and grea-ea-eat -a-I'm here to take you down a peg -a-Oh, whoa, oh-whoa-oh-whoa-oh-oh -a-By the time I'm done, you're gonna beg -a-Oh, whoa, oh-whoa-oh-whoa-oh-oh -a-To be in my band, application rejected! -a-Rejected! -a-Don't look so sad and so dejected -a-And so dejected -a-Don't mean to brag, don't mean to boast -a-But I'm a six-course meal and you're just burnt toast -a-Think I'm gonna ever give up? -a-No, never, ever, ever, ever! -a-Come on, you're just making noise -a-Listen how my music destroys -a-Anything you throw at me -a-I'm gonna throw back, just wait and see-ee -a-Ya better believe -a-I got tricks up my sleeve -a-And I captivate -a-'Cause I'm powerful and grea-ea-eat -a-Oh, whoa, oh-oh-oh-oh -a-Ya better believe -a-I got tricks up my sleeve -a-See me dominate |11|7
115|Awesome as I wanna be|Hey! Hey! Hey! Hey! Hey! Hey! -a-Awesome as I wanna be -a-Hey! Hey! Hey! Hey! Hey! Hey! -a-Awesome as I wanna be -a-First you see me riding on a sonic boom -a-Got my guitar shreddin' up the latest tune -a-There is nothin' you can do to beat me -a-I'm so good that you can't defeat me -a-Yeah!, I'm awesome, -a-Take caution -a-Watch out for me, -a-I'm awesome as I wanna be -a-Yeah!, I'm awesome, -a-Take caution -a-Watch out for me, -a-I'm awesome as I wanna be -a-Hey! Hey! Hey! Hey! Hey! Hey! -a-Hey! Hey! Hey! Hey! Hey! Hey! -a-Step aside now, -a-You're just gettin' in my way -a-I got sick chops you can never hope to play -a-When it comes to makin' music, I'm A Gruler -a-You wish you could be twenty percent cooler -a-Yeah!, I'm awesome, -a-Take caution -a-Watch out for me, -a-I'm awesome as I wanna be -a-Yeah!, I'm awesome, -a-Take caution -a-Watch out for me, |11|8
116|Welcome to the Show|Welcome to the show -a-We're here to let you know -a-Our time is now -a-Your time is running out -a-Feel the wave of sound -a-As it crashes down -a-You can't turn away -a-We'll make you wanna sta -a-a-ay -a-We will be adored -a-Tell us that you want us -a-We won't be ignored -a-It's time for our reward -a-Now you need us -a-Come and heed us -a-Nothing can stop us now -a-Oh-oh, oh-whoa-oh -a-I've got the music in me -a-Oh-oh, oh-whoa-oh -a-Don't need to hear a crowd -a-Cheering out my name -a-I didn't come here seeking -a-Infamy or fame -a-The one and only thing -a-That I am here to bring -a-Is music, is the music -a-Is the music in my soul -a-Gonna break out (Out!) -a-Set myself free, yeah -a-Let it all go (Go!) -a-Just let it be, yeah -a-Find the music in your heart -a-Let the music make you start -a-To set yourself apart -a-What we have in store (ah-ah) -a-All we want and more (ah-ah) -a-We will break on through (ah-ah) -a-Now it's time to finish you! -a-You're never gonna bring me down -a-You're never gonna break this part of me -a-My friends are here to bring me 'round -a-Not singing just for popularity -a-We're here to let you know -a-That we won't let it go -a-Our music is a bomb and it's about to blow -a-And you can try to fight -a-But we have got the light of -a-Friendship on our side! -a-Got the music in our hearts -a-We're here to blow this thing apart -a-And together, we will never -a-Be afraid of the dark -a-Here to sing our song out loud -a-Get you dancing with the crowd -a-As the music of our friendship -a-Survives, survives! -a-Got the music in our hearts -a-We're here to blow this thing apart -a-And together, we will never -a-Be afraid of the dark -a-Here to sing our song out loud -a-Get you dancing with the crowd -a-As the music of our friendship |11|9
117|Shine Like Rainbows|Once upon a time -a-You came into my world and made the stars align -a-Now I can see the signs -a-You pick me up when I get down so I can shine -a-Shine like rainbows -a-Shine like rainbows -a-Friends, you are in my life -a-And you can count on me to be there by your side -a-And when the music comes alive -a-We sing our songs to lift us up so we can shine -a-And the sound that we hear in our hearts -a-Makes a crescendo -a-And the light that ignites in the dark -a-It makes us all glow -a-And shine like rainbows -a-We shine like rainbows -a-Together we stand -a-As the rain begins to fall -a-And holdin' our heads up high -a-As the sun shines through it all -a-And the sound that we hear in our hearts -a-Makes a crescendo -a-And the light that ignites in the dark -a-It makes us all glow -a-And shine like rainbows -a-We shine like rainbows -a-Shine like rainbows -a-We shine like rainbows |11|10
118|My Past is Not Today|Power -a-Was all I desired (I desired, all I desired) -a-But all that grew inside me -a-Was the darkness I acquired -a-When I began to fall -a-And I lost the path ahead -a-That's when your friendship found me -a-And it lifted me instead -a-Like a phoenix burning bright -a-In the sky -a-I'll show there's another side to me -a-You can't deny -a-I may not know what the future holds -a-But hear me when I say -a-That my past does not define me -a-'Cause my past is not today -a-Ambition -a-Is what I believed -a-Would be the only way -a-To set me free -a-But when it disappeared -a-And I found myself alone -a-That's when you came and got me -a-And it felt like I was home -a-Like a phoenix burning bright -a-In the sky -a-I'll show there's another side to me -a-You can't deny -a-I may not know what the future holds -a-But hear me when I say -a-That my past does not define me |11|11
119|Friendship Through the Ages|Nothing stays the same for long -a-But when it changes doesn't mean it's gone -a-Time will always get away -a-As it leaves behind another day -a-Things may come and things may go -a-Some go fast and some go slow -a-Few things last, that's all I know -a-But friendship carries on through the ages -a-Things may come and things may go -a-Some go fast and some go slow -a-Few things last, that's all I know -a-But friendship carries on through the ages -a-Been around for a long time -a-Rocking out hard 'cause I'm in my prime -a-Maybe it'll change further down the line -a-But my friendship carries on through the ages -a-Every single style has something -a-Different it can say -a-There's nothing wrong with being unique -a-And special in your own way -a-Maybe you wanna be a pop star -a-Get your fifteen minutes of fame, wha, ah! Ah, oh! -a-That won't last forever -a-But friendship remains the same, ah-oh, oh! -a-Things may come and things may go -a-Some go fast and some go slow -a-Few things last, that's all I know -a-But friendship carries on through the ages -a-Things may come and things may go -a-Some go fast and some go slow -a-Few things last, that's all I know -a-But friendship carries on through the ages |11|12
